{
  "schema_version": 2,
  "revision": "official-2026-09-06-1",
  "families": [
    {
      "prefix": "gpt-",
      "provider": "openai"
    },
    {
      "prefix": "o1",
      "provider": "openai"
    },
    {
      "prefix": "o3",
      "provider": "openai"
    },
    {
      "prefix": "o4",
      "provider": "openai"
    },
    {
      "prefix": "chatgpt-",
      "provider": "openai"
    },
    {
      "prefix": "codex",
      "provider": "openai"
    },
    {
      "prefix": "claude",
      "provider": "anthropic"
    },
    {
      "prefix": "gemini",
      "provider": "google"
    },
    {
      "prefix": "gemma",
      "provider": "google"
    },
    {
      "prefix": "grok",
      "provider": "xai"
    },
    {
      "prefix": "kimi",
      "provider": "moonshot"
    },
    {
      "prefix": "k2",
      "provider": "moonshot"
    },
    {
      "prefix": "moonshot",
      "provider": "moonshot"
    },
    {
      "prefix": "deepseek",
      "provider": "deepseek"
    },
    {
      "prefix": "composer",
      "provider": "cursor"
    }
  ],
  "models": [
    {
      "canonical_id": "gpt-5.5",
      "aliases": [
        {
          "reported_model": "GPT-5.5[1m]",
          "provider": "openai",
          "agent": "codex",
          "effective_from": "2026-04-24"
        }
      ]
    },
    {
      "canonical_id": "gpt-5.6-sol",
      "aliases": [
        {
          "reported_model": "gpt-5.6",
          "provider": "openai",
          "effective_from": "2026-07-09"
        }
      ]
    },
    {
      "canonical_id": "grok-4.5",
      "aliases": [
        {
          "reported_model": "grok-4.5-latest",
          "provider": "xai",
          "effective_from": "2026-07-08"
        },
        {
          "reported_model": "grok-4.5-build",
          "provider": "xai",
          "agent": "grok",
          "effective_from": "2026-07-08"
        }
      ]
    },
    {
      "canonical_id": "grok-4.6",
      "aliases": [
        {
          "reported_model": "grok-4.6-build",
          "provider": "xai",
          "agent": "grok",
          "effective_from": "2026-08-12"
        }
      ]
    },
    {
      "canonical_id": "kimi-k2.5",
      "aliases": [
        {
          "reported_model": "k2p5",
          "provider": "moonshot",
          "agent": "opencode",
          "effective_from": "2026-02-01"
        }
      ]
    },
    {
      "canonical_id": "gemini-2.5-pro",
      "aliases": [
        {
          "reported_model": "gemini-2.5-pro-preview",
          "provider": "google",
          "effective_from": "2025-05-06"
        }
      ]
    },
    {
      "canonical_id": "gemini-2.5-flash",
      "aliases": [
        {
          "reported_model": "gemini-2.5-flash-preview",
          "provider": "google",
          "effective_from": "2025-05-20"
        }
      ]
    },
    {
      "canonical_id": "gemini-3.1-pro-preview",
      "aliases": [
        {
          "reported_model": "gemini-3-pro-preview",
          "provider": "google",
          "agent": "gemini",
          "effective_from": "2026-01-01"
        }
      ]
    },
    {
      "canonical_id": "gemini-3.5-flash",
      "aliases": [
        {
          "reported_model": "gemini-3-flash-preview",
          "provider": "google",
          "effective_from": "2026-01-01"
        }
      ]
    }
  ]
}
